{"qusxAudio":"0.1","surah":62,"layoutAgnostic":true,"language":"en","base":"https://quran-wbw-audio.quran-wbw.workers.dev/en/v1/","words":{"76509":"g5aa4a5338c","76510":"ga08da15c96","76511":"gd869db7fe6","76512":"g0fde5915cb","76513":"gfdc86ac359","76514":"g40477b68d2","76515":"g0fde5915cb","76516":"g378a670717","76517":"g1ba5c170c9","76518":"g79acf014cf","76519":"g6461bbe037","76520":"gc028277284","76522":"g30f088ea66","76523":"gbab1e4d70f","76524":"g27e7700fda","76525":"g2d5a829c4e","76526":"gac7810c7d9","76527":"g2cb515a1a2","76528":"gbf42350868","76529":"g2e2d0ee422","76530":"g0d9db5d881","76531":"g36bf26093b","76532":"g334d4717b6","76533":"g4ffbf2de56","76534":"gc646b59007","76535":"g2a59019763","76536":"gdea713fc73","76537":"gfffacf5a96","76538":"g0b1e95cfd9","76539":"g51de2b835b","76540":"g7fec283adf","76541":"g2597c3398a","76542":"g168cbb2ea5","76544":"g7a6bad4b88","76545":"g847a6ee374","76546":"gb2aeaef359","76547":"gc080c4dfb9","76548":"g98910a6e9a","76549":"g02cc3824b7","76550":"g87e736a7ca","76551":"gc028277284","76553":"g33b8220108","76554":"g599bbc98fb","76555":"gab789dae55","76556":"g644f6d49bc","76557":"g1f10face11","76558":"g5ee5d6b1b4","76559":"g73bed96bc4","76560":"g4bbd000e68","76561":"g13fce92405","76562":"g54baa9779c","76564":"g0153d23ad1","76565":"gefea170000","76566":"gb173b1d925","76567":"g91583d91b9","76568":"g6f8f8e9f76","76569":"g557f255516","76570":"gcc4369edad","76571":"g9f6334181a","76572":"g6c1baa39ce","76573":"gb9fb5258ae","76574":"g2aed5404c8","76575":"g43094eaa63","76576":"g9246a12722","76577":"ge756f63ef3","76578":"gb7adf77905","76579":"g1d16dc2dcc","76580":"g03e3f2411e","76581":"gab789dae55","76582":"g73bed96bc4","76583":"g7309329e11","76584":"g4956faddb7","76585":"g32b28ca04c","76586":"g819a3827c0","76588":"gdc01c6b748","76589":"g7a81af3e59","76590":"gfc45e91c75","76591":"gb2ee1fcac9","76592":"g958f57f57d","76593":"gb169b44ea9","76594":"g1183535574","76595":"g3e375e0a7f","76596":"gab789dae55","76597":"g0b1e95cfd9","76598":"g3a55baca5c","76599":"g32b28ca04c","76600":"g9cba1ccc74","76601":"gdfc2ac8750","76602":"g958f57f57d","76603":"g5d6dd75b83","76604":"g0ae22cb29e","76606":"g9d7f5ee2a8","76607":"g526e5e310d","76608":"g55472e5395","76609":"g5f88d90281","76610":"gc34f2f8b36","76611":"gdc4327a311","76612":"g73bed96bc4","76613":"g2588075f9e","76614":"g1cd4df0287","76616":"gdc01c6b748","76617":"ga85ed0f0a4","76618":"g0a17e301d8","76619":"ged04ff4dab","76620":"g041568c2d7","76621":"g21e8d78d67","76622":"g63320de06f","76623":"ge769604d07","76624":"g6f8f8e9f76","76625":"gcc77bf8acb","76626":"g4374aaee24","76627":"g27d488fd17","76628":"g9ed43b9826","76629":"g17ff3a9004","76630":"ga5cc72325c","76631":"gca71c54f45","76632":"gc5d2017779","76633":"geadcd9bd2a","76635":"g7a81af3e59","76636":"gfc45e91c75","76637":"g94ec44c4f4","76638":"g30603fa9e0","76639":"gd6af1dd385","76640":"g4f82b7d947","76641":"gdb3d405b10","76642":"gef8f2e60cb","76643":"g839e75e35b","76644":"gd0b5da9367","76645":"g4374aaee24","76646":"g7302076874","76647":"gab789dae55","76648":"g1d59e0aa81","76649":"gd8aabf0dcf","76650":"g33b8220108","76651":"g4a7d2fb8d4","76652":"g463ed54002","76653":"g958f57f57d","76654":"g8af56de682","76655":"g97accafb53","76657":"g88bc2703a9","76658":"g94134688e8","76659":"g4e1c961e54","76660":"g5d4a82da53","76661":"gaf10ef20dd","76662":"g96b12bad6e","76663":"g693f6ff656","76664":"g0b1e95cfd9","76665":"g219e87c4ed","76666":"gab789dae55","76667":"g1fedddcfc3","76668":"ga08da15c96","76669":"g7d3f44729d","76670":"gafa4100ed7","76671":"g013b6e6fb5","76673":"g3f536d4657","76674":"gbda732604b","76675":"g85d6e8fffa","76676":"g1758356db2","76677":"gf534b7ba52","76678":"g789977dfc8","76679":"g6446a417d2","76680":"ga976e4a695","76681":"g8b6cd6222f","76682":"gdc01c6b748","76683":"ga110e6b9a3","76684":"gf1f4d1d177","76685":"ga08da15c96","76686":"g4a7d2fb8d4","76687":"gd820aa5f87","76688":"g1a0ac8bba7","76689":"gfedb8d268e","76690":"gc6fa312bfb","76691":"g73bed96bc4","76692":"g00e1dff192","76693":"ge604ebef8f"},"text":{"g00e1dff192":"is the best","g013b6e6fb5":"succeed","g0153d23ad1":"the likeness","g02cc3824b7":"And He","g03e3f2411e":"the signs","g041568c2d7":"you flee","g0a17e301d8":"the death","g0ae22cb29e":"truthful","g0b1e95cfd9":"from","g0d9db5d881":"to them","g0fde5915cb":"is in","g1183535574":"that you","g13fce92405":"of bounty","g168cbb2ea5":"clear","g1758356db2":"or","g17ff3a9004":"and the witnessed","g1a0ac8bba7":"the sport","g1ba5c170c9":"the Sovereign","g1cd4df0287":"of the wrongdoers","g1d16dc2dcc":"deny","g1d59e0aa81":"And leave","g1f10face11":"to whom","g1fedddcfc3":"and remember","g219e87c4ed":"the Bounty","g21e8d78d67":"from it","g2588075f9e":"is All-Knowing","g2597c3398a":"an error","g27d488fd17":"the All-Knower","g27e7700fda":"sent","g2a59019763":"and the wisdom","g2aed5404c8":"books","g2cb515a1a2":"a Messenger","g2d5a829c4e":"among","g2e2d0ee422":"reciting","g30603fa9e0":"When","g30f088ea66":"He","g32b28ca04c":"the people","g334d4717b6":"and purifying them","g33b8220108":"That","g36bf26093b":"His verses","g378a670717":"the earth","g3a55baca5c":"excluding","g3e375e0a7f":"are allies","g3f536d4657":"And when","g40477b68d2":"And whatever","g43094eaa63":"Wretched is","g4374aaee24":"to","g463ed54002":"for you","g4956faddb7":"guide","g4a7d2fb8d4":"is better","g4bbd000e68":"is the Possessor","g4e1c961e54":"the prayer","g4f82b7d947":"for the prayer","g4ffbf2de56":"and teaching them","g51de2b835b":"before","g526e5e310d":"they will wish for it","g54baa9779c":"the Great","g55472e5395":"ever","g557f255516":"not","g599bbc98fb":"is the Bounty","g5aa4a5338c":"glorifies","g5d4a82da53":"then disperse","g5d6dd75b83":"you are","g5ee5d6b1b4":"He wills","g5f88d90281":"for what","g63320de06f":"then surely it","g6446a417d2":"to it","g644f6d49bc":"He gives it","g6461bbe037":"the All-Mighty","g693f6ff656":"and seek","g6c1baa39ce":"the donkey","g6f8f8e9f76":"then","g7302076874":"the remembrance","g7309329e11":"does not","g73bed96bc4":"And Allah","g789977dfc8":"they rushed","g79acf014cf":"the Holy","g7a6bad4b88":"and others","g7a81af3e59":"O","g7d3f44729d":"much","g7fec283adf":"surely in","g819a3827c0":"the wrongdoers","g839e75e35b":"of Friday","g847a6ee374":"among them","g85d6e8fffa":"a transaction","g87e736a7ca":"is the All-Mighty","g88bc2703a9":"then when","g8af56de682":"You","g8b6cd6222f":"standing","g91583d91b9":"with the Taurat","g9246a12722":"the example","g94134688e8":"is concluded","g94ec44c4f4":"believe","g958f57f57d":"if","g96b12bad6e":"the land","g97accafb53":"know","g98910a6e9a":"them","g9cba1ccc74":"then wish","g9d7f5ee2a8":"but not","g9ed43b9826":"of the unseen","g9f6334181a":"is like","ga08da15c96":"Allah","ga110e6b9a3":"what","ga5cc72325c":"and He will inform you","ga85ed0f0a4":"Indeed","ga976e4a695":"and left you","gab789dae55":"of Allah","gac7810c7d9":"the unlettered","gaf10ef20dd":"In","gafa4100ed7":"so that you may","gb169b44ea9":"you claim","gb173b1d925":"were entrusted","gb2aeaef359":"who have not yet","gb2ee1fcac9":"are Jews","gb7adf77905":"who","gb9fb5258ae":"who carries","gbab1e4d70f":"is the One Who","gbda732604b":"they saw","gbf42350868":"from themselves","gc028277284":"the All-Wise","gc080c4dfb9":"joined","gc34f2f8b36":"have sent forth","gc5d2017779":"you used to","gc646b59007":"the Book","gc6fa312bfb":"any transaction","gca71c54f45":"of what","gcc4369edad":"they bore it","gcc77bf8acb":"you will be sent back","gd0b5da9367":"then hasten","gd6af1dd385":"the call is made","gd820aa5f87":"than","gd869db7fe6":"Whatever","gd8aabf0dcf":"the business","gdb3d405b10":"on","gdc01c6b748":"say","gdc4327a311":"their hands","gdea713fc73":"although","gdfc2ac8750":"for the death","ge604ebef8f":"of the providers","ge756f63ef3":"of the people","ge769604d07":"will meet you","geadcd9bd2a":"do","ged04ff4dab":"which","gef8f2e60cb":"the day","gefea170000":"of those who","gf1f4d1d177":"is with","gf534b7ba52":"a sport","gfc45e91c75":"you who","gfdc86ac359":"the heavens","gfedb8d268e":"And from","gfffacf5a96":"they were"}}