{"qusxAudio":"0.1","surah":107,"layoutAgnostic":true,"language":"en","base":"https://quran-wbw-audio.quran-wbw.workers.dev/en/v1/","words":{"83469":"gaf755487ea","83470":"gc4bbef5681","83471":"gb72df6927d","83472":"g76ae265415","83474":"g145308fb65","83475":"gbab1e4d70f","83476":"gedb8b35abb","83477":"ga3d9149982","83479":"g89a040bf57","83480":"g7ff69e1787","83481":"g4374aaee24","83482":"g65c3466e88","83483":"ge70dbe6620","83485":"g6fd2df2e4e","83486":"g83bf5a2b5f","83488":"gc8b91b55cc","83489":"gf1fdd46d8d","83490":"g5780daf6db","83491":"g5846661905","83492":"g8009b8e09c","83494":"gc8b91b55cc","83495":"gf1fdd46d8d","83496":"g0e7b123ddb","83498":"g32dd66ccf0","83499":"g1c948adff7"},"text":{"g0e7b123ddb":"make show","g145308fb65":"then that","g1c948adff7":"the small kindnesses","g32dd66ccf0":"And they deny","g4374aaee24":"to","g5780daf6db":"about","g5846661905":"their prayers","g65c3466e88":"feed","g6fd2df2e4e":"So woe","g76ae265415":"the Judgment","g7ff69e1787":"feel the urge","g8009b8e09c":"are neglectful","g83bf5a2b5f":"to those who pray","g89a040bf57":"and does not","ga3d9149982":"the orphan","gaf755487ea":"Have you seen","gb72df6927d":"denies","gbab1e4d70f":"is the One Who","gc4bbef5681":"the One Who","gc8b91b55cc":"Those who","ge70dbe6620":"the poor","gedb8b35abb":"repulses","gf1fdd46d8d":"they"}}