{"qusxAudio":"0.1","surah":81,"layoutAgnostic":true,"language":"en","base":"https://quran-wbw-audio.quran-wbw.workers.dev/en/v1/","words":{"81410":"g30603fa9e0","81411":"g1d4a9ef0fb","81412":"g4b3c41c66c","81414":"g3f536d4657","81415":"gc942548dff","81416":"ga938c4dd22","81418":"g3f536d4657","81419":"g774cd42626","81420":"g05bd383f5b","81422":"g3f536d4657","81423":"g5d350973a5","81424":"g13ab8f9888","81426":"g3f536d4657","81427":"g99291a8d7e","81428":"g6a99b085ae","81430":"g3f536d4657","81431":"gf196a0e310","81432":"ge612391246","81434":"g3f536d4657","81435":"g023e8d61ce","81436":"g71c2de7112","81438":"g3f536d4657","81439":"g7cedc07f5f","81440":"gf1dd995c58","81442":"g5f88d90281","81443":"g7d14c04a71","81444":"gc689e09eb7","81446":"g3f536d4657","81447":"g7f8945cf2a","81448":"g7f9a4cf957","81450":"g3f536d4657","81451":"g2dbd632d67","81452":"g23dcfb1fee","81454":"g3f536d4657","81455":"g00e95d3c23","81456":"g727459b341","81458":"g3f536d4657","81459":"gee87e62281","81460":"g867ab65f8a","81462":"gcede9b9d3c","81463":"g512453b3b9","81464":"ga110e6b9a3","81465":"gd884fc91fd","81467":"g5c06a4d783","81468":"g311b74364b","81469":"g1089afb0d6","81471":"gc52c0804d9","81472":"ga469806d09","81474":"gc1b3593bd8","81475":"g30603fa9e0","81476":"g7102c6a281","81478":"g3efef0099e","81479":"g30603fa9e0","81480":"g40f0249145","81482":"g238a706f35","81483":"g5e3e74d908","81484":"gab12ad132c","81485":"g8eca84b70e","81487":"g36db3b6956","81488":"gb573f24e55","81489":"g8fcd25a39d","81490":"g514af3f451","81491":"g90b9932ec7","81492":"gd015cc465b","81494":"g66c58ed14d","81495":"gcffa50a32c","81496":"ga4bdbf4a8a","81498":"g2f3522d840","81499":"g955dad2f11","81500":"g1b3cccda27","81502":"g299958a12c","81503":"g0048fbf281","81504":"gf987688a50","81505":"gc2f3abd4f1","81507":"g2f3522d840","81508":"g766d6bac28","81509":"gdb3d405b10","81510":"gdd02d75c70","81511":"g4662cbf5e3","81513":"g2f3522d840","81514":"g6c5522ca8a","81515":"g7b6b2ab169","81516":"g0e58fa98b2","81517":"g468a977bdb","81519":"gc99f8a7ecd","81520":"gb6d48a123d","81522":"g557f255516","81523":"g6c5522ca8a","81524":"g1ffd205e2e","81525":"g5ddfdcda94","81526":"g6a2ef9c70b","81528":"g24ffa2e508","81529":"gcd4aae0536","81530":"g1e5a471f7c","81531":"g4374aaee24","81532":"g8eff225e49","81534":"g2f3522d840","81535":"g6944b671e4","81536":"g672fccd70b","81537":"g33b8220108","81538":"gcd4aae0536","81539":"ga08da15c96","81540":"g0cb26e2242","81541":"g28fc79f146"},"text":{"g0048fbf281":"he saw him","g00e95d3c23":"the Hellfire","g023e8d61ce":"the souls","g05bd383f5b":"are moved away","g0cb26e2242":"Lord","g0e58fa98b2":"of Shaitaan","g1089afb0d6":"by the retreating planets","g13ab8f9888":"are left untended","g1b3cccda27":"mad","g1d4a9ef0fb":"the sun","g1e5a471f7c":"among you","g1ffd205e2e":"is except","g238a706f35":"Indeed , it","g23dcfb1fee":"is stripped away","g24ffa2e508":"for whoever","g28fc79f146":"of the worlds","g299958a12c":"And certainly","g2dbd632d67":"the sky","g2f3522d840":"and not","g30603fa9e0":"When","g311b74364b":"I swear","g33b8220108":"That","g36db3b6956":"Possessor of","g3efef0099e":"And the dawn","g3f536d4657":"And when","g40f0249145":"it breathes","g4374aaee24":"to","g4662cbf5e3":"a withholder","g468a977bdb":"accursed","g4b3c41c66c":"is wrapped up","g512453b3b9":"a soul","g514af3f451":"the Owner of","g557f255516":"not","g5c06a4d783":"But nay","g5d350973a5":"the full-term she-camels","g5ddfdcda94":"a reminder","g5e3e74d908":"is surely a word","g5f88d90281":"for what","g66c58ed14d":"One to be obeyed","g672fccd70b":"except","g6944b671e4":"You will","g6a2ef9c70b":"to the worlds","g6a99b085ae":"are gathered","g6c5522ca8a":"it","g7102c6a281":"it departs","g71c2de7112":"are paired","g727459b341":"is set ablaze","g766d6bac28":"he is","g774cd42626":"the mountains","g7b6b2ab169":"is the word","g7cedc07f5f":"the female infant buried alive","g7d14c04a71":"sin","g7f8945cf2a":"the pages","g7f9a4cf957":"are laid open","g867ab65f8a":"is brought near","g8eca84b70e":"noble","g8eff225e49":"take a straight way","g8fcd25a39d":"with","g90b9932ec7":"the Throne","g955dad2f11":"is your companion","g99291a8d7e":"the wild beasts","ga08da15c96":"Allah","ga110e6b9a3":"what","ga469806d09":"and disappear","ga4bdbf4a8a":"trustworthy","ga938c4dd22":"fall , losing their luster","gab12ad132c":"of a Messenger","gb573f24e55":"power","gb6d48a123d":"are you going","gc1b3593bd8":"And the night","gc2f3abd4f1":"the clear","gc52c0804d9":"Those that run","gc689e09eb7":"she was killed","gc942548dff":"the stars","gc99f8a7ecd":"So where","gcd4aae0536":"wills","gcede9b9d3c":"will know","gcffa50a32c":"and","gd015cc465b":"secure","gd884fc91fd":"it has brought","gdb3d405b10":"on","gdd02d75c70":"the unseen","ge612391246":"are made to overflow","gee87e62281":"Paradise","gf196a0e310":"the seas","gf1dd995c58":"is asked","gf987688a50":"in the horizon"}}