{"qusxAudio":"0.1","surah":114,"layoutAgnostic":true,"language":"en","base":"https://quran-wbw-audio.quran-wbw.workers.dev/en/v1/","words":{"83643":"gdc01c6b748","83644":"g927eebc684","83645":"g9340ea6784","83646":"g574691c9d2","83648":"g297f1e9a03","83649":"g574691c9d2","83651":"gc06246b134","83652":"g574691c9d2","83654":"g0b1e95cfd9","83655":"gcb539d2c41","83656":"g74b6ec6437","83657":"gb270d9972e","83659":"gc4bbef5681","83660":"g59addbd440","83661":"gaf10ef20dd","83662":"g66808fbe0f","83663":"g574691c9d2","83665":"g0b1e95cfd9","83666":"g52da29e50a","83667":"g3e9beecba1"},"text":{"g0b1e95cfd9":"from","g297f1e9a03":"the king","g3e9beecba1":"and men","g52da29e50a":"the jinn","g574691c9d2":"of mankind","g59addbd440":"whispers","g66808fbe0f":"the breasts","g74b6ec6437":"of the whisperer","g927eebc684":"I seek refuge","g9340ea6784":"in the Lord","gaf10ef20dd":"In","gb270d9972e":"the one who withdraws","gc06246b134":"the God","gc4bbef5681":"the One Who","gcb539d2c41":"the evil","gdc01c6b748":"say"}}