{"qusxAudio":"0.1","surah":98,"layoutAgnostic":true,"language":"en","base":"https://quran-wbw-audio.quran-wbw.workers.dev/en/v1/","words":{"83081":"g557f255516","83082":"ga315dee0bd","83083":"gc8b91b55cc","83084":"gabe1a595cf","83085":"g0b1e95cfd9","83086":"g32b28ca04c","83087":"g2cb313e83f","83088":"gb6706991de","83089":"ga8a4decf23","83090":"gb310f4d4d8","83091":"g713e545547","83092":"gb973e92a16","83094":"g2cb515a1a2","83095":"g0b1e95cfd9","83096":"ga08da15c96","83097":"g2e2d0ee422","83098":"geec6542d2e","83099":"g903ada1687","83101":"g04d5ad51c1","83102":"g91222441a5","83103":"g3179a65eff","83105":"g2f3522d840","83106":"gc1453985b3","83107":"gc8b91b55cc","83108":"g9623373936","83109":"gc646b59007","83110":"gb310f4d4d8","83111":"g0b1e95cfd9","83112":"g405906c9d5","83113":"ga110e6b9a3","83114":"g3206bcf2b5","83115":"g17f5997f57","83117":"g2f3522d840","83118":"g412fca88b9","83119":"g672fccd70b","83120":"g1fea18f35f","83121":"ga08da15c96","83122":"ga7ce3a0e82","83123":"ge82f9d9395","83124":"g87a1563bd4","83125":"g133375685a","83126":"gd511c84df6","83127":"g4e1c961e54","83128":"gad0d23ad9f","83129":"g5d5b40f328","83130":"g978d1db63d","83131":"g3ca21ca816","83132":"gaec4c26597","83134":"ga85ed0f0a4","83135":"gc8b91b55cc","83136":"g7a09242b9d","83137":"g0b1e95cfd9","83138":"g32b28ca04c","83139":"g2cb313e83f","83140":"gb6706991de","83141":"gd8036a3c81","83142":"g0833918887","83143":"g88c88bb01b","83144":"ga290c2dfcb","83145":"g87c4c3f55b","83146":"g6ccf720ae2","83147":"gf1fdd46d8d","83148":"g82adf50590","83149":"g83e17877f8","83151":"ga85ed0f0a4","83152":"gc8b91b55cc","83153":"g94ec44c4f4","83154":"g80db8118cc","83155":"g52281f0df5","83156":"g6ccf720ae2","83157":"gf1fdd46d8d","83158":"gdb063090f5","83159":"g83e17877f8","83161":"gfad252cc9e","83162":"gf1f4d1d177","83163":"g46e077d699","83164":"g2c8aedcda4","83165":"g09a63fdffe","83166":"gd8f7e9c783","83167":"g0b1e95cfd9","83168":"gd403217c95","83169":"g0cf660f44b","83170":"g7960e3893d","83171":"g87c4c3f55b","83172":"ge07f8c4ab6","83173":"g3aeff71ee0","83174":"ga08da15c96","83175":"g019295fe0f","83176":"g376fa548ac","83177":"g9dabad230e","83178":"g33b8220108","83179":"g814be81391","83180":"g50758f72a1","83181":"g1a33bedbca"},"text":{"g019295fe0f":"with them","g04d5ad51c1":"wherein","g0833918887":"the Fire","g09a63fdffe":"of Eternity","g0b1e95cfd9":"from","g0cf660f44b":"the rivers","g133375685a":"upright","g17f5997f57":"of the clear evidence","g1a33bedbca":"his Lord","g1fea18f35f":"to worship","g2c8aedcda4":"gardens","g2cb313e83f":"of the Book","g2cb515a1a2":"a Messenger","g2e2d0ee422":"reciting","g2f3522d840":"and not","g3179a65eff":"correct","g3206bcf2b5":"came to them","g32b28ca04c":"the people","g33b8220108":"That","g376fa548ac":"and they will be pleased","g3aeff71ee0":"will be pleased","g3ca21ca816":"is the religion","g405906c9d5":"after","g412fca88b9":"they were commanded","g46e077d699":"their Lord","g4e1c961e54":"the prayer","g50758f72a1":"feared","g52281f0df5":"righteous deeds","g557f255516":"not","g5d5b40f328":"the zakah","g672fccd70b":"except","g6ccf720ae2":"Those","g713e545547":"there comes to them","g7960e3893d":"will abide","g7a09242b9d":"disbelieve","g80db8118cc":"and do","g814be81391":"is for whoever","g82adf50590":"are the worst","g83e17877f8":"of the creatures","g87a1563bd4":"in the religion","g87c4c3f55b":"therein","g88c88bb01b":"of Hell","g903ada1687":"purified","g91222441a5":"are writings","g94ec44c4f4":"believe","g9623373936":"were given","g978d1db63d":"and that","g9dabad230e":"with him","ga08da15c96":"Allah","ga110e6b9a3":"what","ga290c2dfcb":"abiding eternally","ga315dee0bd":"were","ga7ce3a0e82":"being sincere","ga85ed0f0a4":"Indeed","ga8a4decf23":"to be abandoned","gabe1a595cf":"disbelieved","gad0d23ad9f":"and to give","gaec4c26597":"the correct","gb310f4d4d8":"until","gb6706991de":"and the polytheists","gb973e92a16":"the clear evidence","gc1453985b3":"became divided","gc646b59007":"the Book","gc8b91b55cc":"Those who","gd403217c95":"underneath them","gd511c84df6":"and to establish","gd8036a3c81":"will be in","gd8f7e9c783":"flow","gdb063090f5":"are the Best","ge07f8c4ab6":"forever","ge82f9d9395":"to Him","geec6542d2e":"pages","gf1f4d1d177":"is with","gf1fdd46d8d":"they","gfad252cc9e":"their reward"}}