{"qusxAudio":"0.1","surah":88,"layoutAgnostic":true,"language":"en","base":"https://quran-wbw-audio.quran-wbw.workers.dev/en/v1/","words":{"82279":"gf6f39fbf67","82280":"g85d9691e23","82281":"g72e71318ae","82282":"g49d2034405","82284":"g3b820cc1bc","82285":"g6c2517c002","82286":"g3c0db9df2c","82288":"ga446bf4bec","82289":"g4105cfdd95","82291":"gdb38f81e2e","82292":"ge43dee5c38","82293":"gb4261382a0","82295":"g16b45fd6df","82296":"g0b1e95cfd9","82297":"g754b7a03fd","82298":"g20bea61795","82300":"g8430a02856","82301":"ge29ef1488f","82302":"g39ccb32d95","82303":"g672fccd70b","82304":"g0b1e95cfd9","82305":"g31d69ffcef","82307":"g557f255516","82308":"g72f43245ce","82309":"g2f3522d840","82310":"g9ff8c2ca25","82311":"g0b1e95cfd9","82312":"ge2e63b387c","82314":"g3b820cc1bc","82315":"g6c2517c002","82316":"g4167fcf926","82318":"gfe4278319f","82319":"ga34b2d93b4","82321":"gaf10ef20dd","82322":"g5a8a00f260","82323":"g34f6576393","82325":"g557f255516","82326":"g1dbfbc9f6d","82327":"g87c4c3f55b","82328":"g8891404847","82330":"g87c4c3f55b","82331":"ge42a9f2f82","82332":"g7fe9ee4f65","82334":"g87c4c3f55b","82335":"g9c14637e05","82336":"g718c4834d5","82338":"g412a96bd1f","82339":"gd56aae11d2","82341":"g640eae5a36","82342":"gaed5ddefda","82344":"g423c37d1e1","82345":"g531a7a718d","82347":"g328b4104e4","82348":"gc204ac9a59","82349":"g142d70a780","82350":"g7601c2f2d0","82351":"g0b064373fb","82352":"gfc92f1cf2c","82354":"gc93e91eb59","82355":"g2dbd632d67","82356":"g0b064373fb","82357":"g2bf8990679","82359":"gc93e91eb59","82360":"g774cd42626","82361":"g0b064373fb","82362":"gb4236eb229","82364":"gc93e91eb59","82365":"g378a670717","82366":"g0b064373fb","82367":"ge8a0670a01","82369":"g024c0ebd18","82370":"gf8969a18a0","82371":"g8af56de682","82372":"g8ed837ba81","82374":"gb438e2474b","82375":"g1195114ae3","82376":"ga780d9f6ff","82378":"g786e97b3ee","82379":"gaa39520e70","82380":"g083558ed1c","82381":"g484f28c925","82383":"g95098f2a03","82384":"ga08da15c96","82385":"g6aa214247c","82386":"g9d6d39ec89","82388":"ga85ed0f0a4","82389":"gf9717bfdb3","82390":"g08cc95c776","82392":"g6f8f8e9f76","82393":"ga85ed0f0a4","82394":"g93e67ce0f7","82395":"gcefd8607f8"},"text":{"g024c0ebd18":"So remind","g083558ed1c":"turns away","g08cc95c776":"will be their return","g0b064373fb":"How","g0b1e95cfd9":"from","g1195114ae3":"over them","g142d70a780":"towards","g16b45fd6df":"They will be given to drink","g1dbfbc9f6d":"they will hear","g20bea61795":"boiling","g2bf8990679":"it is raised","g2dbd632d67":"the sky","g2f3522d840":"and not","g31d69ffcef":"a bitter thorny plant","g328b4104e4":"then do not","g34f6576393":"elevated","g378a670717":"the earth","g39ccb32d95":"food","g3b820cc1bc":"faces","g3c0db9df2c":"Will be humbled","g4105cfdd95":"exhausted","g412a96bd1f":"and cups","g4167fcf926":"will be joyful","g423c37d1e1":"and carpets","g484f28c925":"and disbelieves","g49d2034405":"of the Overwhelming","g531a7a718d":"spread out","g557f255516":"not","g5a8a00f260":"a garden","g640eae5a36":"And cushions","g672fccd70b":"except","g6aa214247c":"with the punishment","g6c2517c002":"that day","g6f8f8e9f76":"then","g718c4834d5":"raised high","g72e71318ae":"the news","g72f43245ce":"it nourishes","g754b7a03fd":"a spring","g7601c2f2d0":"the camels","g774cd42626":"the mountains","g786e97b3ee":"but","g7fe9ee4f65":"flowing","g8430a02856":"Not is","g85d9691e23":"there come to you","g87c4c3f55b":"therein","g8891404847":"vain talk","g8af56de682":"You","g8ed837ba81":"are a reminder","g93e67ce0f7":"upon us","g95098f2a03":"Then will punish him","g9c14637e05":"will be thrones","g9d6d39ec89":"greatest","g9ff8c2ca25":"it avails","ga08da15c96":"Allah","ga34b2d93b4":"satisfied","ga446bf4bec":"Laboring","ga780d9f6ff":"a controller","ga85ed0f0a4":"Indeed","gaa39520e70":"whoever","gaed5ddefda":"lined up","gaf10ef20dd":"In","gb4236eb229":"they are fixed","gb4261382a0":"intensely hot","gb438e2474b":"You are not","gc204ac9a59":"they look","gc93e91eb59":"And towards","gcefd8607f8":"is their account","gd56aae11d2":"put in place","gdb38f81e2e":"They will burn","ge29ef1488f":"for them","ge2e63b387c":"hunger","ge42a9f2f82":"will be a spring","ge43dee5c38":"in a Fire","ge8a0670a01":"it is spread out","gf6f39fbf67":"has","gf8969a18a0":"Only","gf9717bfdb3":"to us","gfc92f1cf2c":"they are created","gfe4278319f":"With their effort"}}