{"qusxAudio":"0.1","surah":110,"layoutAgnostic":true,"language":"en","base":"https://quran-wbw-audio.quran-wbw.workers.dev/en/v1/","words":{"83546":"g30603fa9e0","83547":"g74f5cacb17","83548":"g5180bcad4a","83549":"gab789dae55","83550":"g00d368ed8c","83552":"g29bb13f387","83553":"g32b28ca04c","83554":"g6c21f7e1c8","83555":"ga379c85f8c","83556":"g18bcfde4ec","83557":"gab789dae55","83558":"gb6bd04d44a","83560":"g84a95dd899","83561":"ga01283d31e","83562":"g1bc0b136c2","83563":"g54d4252d3c","83564":"gd42f34188e","83565":"gb47f363e2b","83566":"g3ae95a7e95"},"text":{"g00d368ed8c":"and the Victory","g18bcfde4ec":"the religion","g1bc0b136c2":"of your Lord","g29bb13f387":"And you see","g30603fa9e0":"When","g32b28ca04c":"the people","g3ae95a7e95":"Oft-Returning","g5180bcad4a":"the Help","g54d4252d3c":"and ask His forgiveness","g6c21f7e1c8":"entering","g74f5cacb17":"comes","g84a95dd899":"Then glorify","ga01283d31e":"with the praises","ga379c85f8c":"into","gab789dae55":"of Allah","gb47f363e2b":"is","gb6bd04d44a":"in multitudes","gd42f34188e":"Indeed , He"}}