{"qusxAudio":"0.1","surah":104,"layoutAgnostic":true,"language":"en","base":"https://quran-wbw-audio.quran-wbw.workers.dev/en/v1/","words":{"83378":"g35d2fbcc97","83379":"gbbdaf90386","83380":"g200f84a1e6","83381":"g8b15dd3c5d","83383":"gc4bbef5681","83384":"gaff05a4612","83385":"gb42f805d80","83386":"gc8b63eda2b","83388":"gbeac9eac1c","83389":"g33b8220108","83390":"g2672f2066f","83391":"g1e5badd06b","83393":"g66a4c6b5a7","83394":"g474e16e808","83395":"gaf10ef20dd","83396":"gd9bc0db182","83398":"g819d96f9cd","83399":"g03f165d7a4","83400":"ga110e6b9a3","83401":"gcff9b6ac75","83403":"g40367aeca6","83404":"ga08da15c96","83405":"ga475d33bcd","83407":"ged04ff4dab","83408":"gf8fd9eca37","83409":"g4374aaee24","83410":"ge631fdf0a5","83412":"g238a706f35","83413":"ge10a4d8d51","83414":"g6f36f9eaa2","83416":"gaf10ef20dd","83417":"g4f1b1dbede","83418":"ga74a18cfae"},"text":{"g03f165d7a4":"will make you know","g1e5badd06b":"will make him immortal","g200f84a1e6":"slanderer","g238a706f35":"Indeed , it","g2672f2066f":"his wealth","g33b8220108":"That","g35d2fbcc97":"Woe","g40367aeca6":"a fire","g4374aaee24":"to","g474e16e808":"Surely he will be thrown","g4f1b1dbede":"columns","g66a4c6b5a7":"Nay","g6f36f9eaa2":"closed over","g819d96f9cd":"and what","g8b15dd3c5d":"backbiter","ga08da15c96":"Allah","ga110e6b9a3":"what","ga475d33bcd":"kindled","ga74a18cfae":"extended","gaf10ef20dd":"In","gaff05a4612":"collects","gb42f805d80":"wealth","gbbdaf90386":"to every","gbeac9eac1c":"thinking","gc4bbef5681":"the One Who","gc8b63eda2b":"and counts it","gcff9b6ac75":"the Crusher is","gd9bc0db182":"the Crusher","ge10a4d8d51":"will be upon them","ge631fdf0a5":"the hearts","ged04ff4dab":"which","gf8fd9eca37":"mounts up"}}