{"qusxAudio":"0.1","surah":80,"layoutAgnostic":true,"language":"en","base":"https://quran-wbw-audio.quran-wbw.workers.dev/en/v1/","words":{"81235":"g1bfa618573","81236":"g25acd0a8ce","81238":"gd1ef4731ec","81239":"g83aac66cfe","81240":"g6683b57754","81242":"g8c2f8a2380","81243":"ga9ca6ad649","81244":"g0b1a2486d3","81245":"gaf4dfb5d52","81247":"g1758356db2","81248":"gf50bc0e54e","81249":"gb58cf92eef","81250":"ga3315f8b71","81252":"gb6b4297705","81253":"g43fb5c6522","81254":"g5be7769948","81256":"g80e0a24c6e","81257":"ge82f9d9395","81258":"g8b9e8ae87d","81260":"g2f3522d840","81261":"g8ee425ab4b","81262":"ge03ffbe3b0","81263":"g2fa67b44a3","81265":"gddc971856e","81266":"gf1cb57c636","81267":"g430d189b0c","81268":"gbb0954e258","81270":"g19f74f5642","81271":"g116b445958","81273":"g213d6665c1","81274":"g0664edd215","81275":"g97c9b7e187","81277":"g66a4c6b5a7","81278":"g238a706f35","81279":"g3e87b6698a","81281":"g77ed5f8f79","81282":"gcd4aae0536","81283":"ga9253f94ff","81285":"gaf10ef20dd","81286":"g76de1d190d","81287":"gaf3ed8fd93","81289":"g8900f26474","81290":"g903ada1687","81292":"g6f9b18b524","81293":"gd8b7bcf239","81295":"g8eca84b70e","81296":"g8da51671c1","81298":"g72f294a2e9","81299":"g9728a0c266","81300":"g0b064373fb","81301":"g19c1242e5d","81303":"g0b1e95cfd9","81304":"ga110e6b9a3","81305":"g863cc374e6","81306":"g8d75483a38","81308":"g0b1e95cfd9","81309":"gf863d3f8cb","81310":"g8d75483a38","81311":"gd95e5967e8","81313":"g6f8f8e9f76","81314":"g6fee95c4cd","81315":"gdcc35ff3ae","81317":"g6f8f8e9f76","81318":"ga82f355cd2","81319":"gb2ba5a39f7","81321":"g6f8f8e9f76","81322":"g30603fa9e0","81323":"g5ee5d6b1b4","81324":"gab5e3d393e","81326":"g66a4c6b5a7","81327":"g557f255516","81328":"g069e5b9e75","81329":"ga110e6b9a3","81330":"ga32a1fa5d3","81332":"gf459c034d9","81333":"g9728a0c266","81334":"g27e90dfa57","81335":"g0a5bb8fbf4","81337":"g68942a0277","81338":"gf80f8c89e8","81339":"ga2eb107a0a","81340":"g17d24a5d72","81342":"g6f8f8e9f76","81343":"g9ca7fe6748","81344":"g378a670717","81345":"g63b1c83ac1","81347":"g4faac28b83","81348":"g87c4c3f55b","81349":"gee4dddc76b","81351":"g021e69502c","81352":"g914544a29f","81354":"g6086af1a61","81355":"g0c8c6b81c7","81357":"gf656ec4c11","81358":"gb85791ca2c","81360":"gcbade748e7","81361":"g9a7d1fc446","81363":"gc37d626b61","81364":"g463ed54002","81365":"ge69ab847ef","81367":"g664a55e5e0","81368":"g74f5cacb17","81369":"gbae7e2aa05","81371":"gef8f2e60cb","81372":"g60ea104664","81373":"gdc305fa431","81374":"g0b1e95cfd9","81375":"g418374d898","81377":"gdda839842e","81378":"gdc2bb3d277","81380":"g01c970f74b","81381":"gefff5db415","81383":"g5b1658c4c9","81384":"g8175e3c875","81385":"g847a6ee374","81386":"g6c2517c002","81387":"gaddfb1742e","81388":"g23acf2f874","81390":"g3b820cc1bc","81391":"g6c2517c002","81392":"ge431f7f9ac","81394":"ga2b3302b09","81395":"gd39fbb97e2","81397":"g063c79ba6a","81398":"g6c2517c002","81399":"g46ccb84a01","81400":"g340ee18994","81402":"g61a8af4969","81403":"g60eb7e5f19","81405":"g6ccf720ae2","81406":"gf1fdd46d8d","81407":"g60996a66fc","81408":"g58d3ec4842"},"text":{"g01c970f74b":"And his wife","g021e69502c":"and grapes","g063c79ba6a":"And faces","g0664edd215":"from Him","g069e5b9e75":"he has accomplished","g0a5bb8fbf4":"his food","g0b064373fb":"How","g0b1a2486d3":"that he might","g0b1e95cfd9":"from","g0c8c6b81c7":"and date-palms","g116b445958":"fears","g1758356db2":"or","g17d24a5d72":"in abundance","g19c1242e5d":"ungrateful is he","g19f74f5642":"while He","g1bfa618573":"he frowned","g213d6665c1":"but you","g238a706f35":"Indeed , it","g23acf2f874":"occupying him","g25acd0a8ce":"and turned away","g27e90dfa57":"at","g2f3522d840":"and not","g2fa67b44a3":"he purifies himself","g30603fa9e0":"When","g340ee18994":"will be dust","g378a670717":"the earth","g3b820cc1bc":"faces","g3e87b6698a":"is a reminder","g418374d898":"his brother","g430d189b0c":"came to you","g43fb5c6522":"him who","g463ed54002":"for you","g46ccb84a01":"upon them","g4faac28b83":"then We caused to grow","g557f255516":"not","g58d3ec4842":"the wicked ones","g5b1658c4c9":"For every","g5be7769948":"considers himself free from need","g5ee5d6b1b4":"He wills","g6086af1a61":"And olive","g60996a66fc":"are the disbelievers","g60ea104664":"will flee","g60eb7e5f19":"darkness","g61a8af4969":"will cover them","g63b1c83ac1":"splitting","g664a55e5e0":"But when","g6683b57754":"the blind man","g66a4c6b5a7":"Nay","g68942a0277":"that we","g6c2517c002":"that day","g6ccf720ae2":"Those","g6f8f8e9f76":"then","g6f9b18b524":"In the hands","g6fee95c4cd":"the way","g72f294a2e9":"Is destroyed","g74f5cacb17":"comes","g76de1d190d":"sheets","g77ed5f8f79":"So whosoever","g80e0a24c6e":"so you","g8175e3c875":"man","g83aac66cfe":"came to him","g847a6ee374":"among them","g863cc374e6":"thing","g87c4c3f55b":"therein","g8900f26474":"Exalted","g8b9e8ae87d":"give attention","g8c2f8a2380":"But what","g8d75483a38":"He created him","g8da51671c1":"dutiful","g8eca84b70e":"noble","g8ee425ab4b":"upon you","g903ada1687":"purified","g914544a29f":"and green fodder","g9728a0c266":"the man","g97c9b7e187":"are distracted","g9a7d1fc446":"and grass","g9ca7fe6748":"We cleaved","ga110e6b9a3":"what","ga2b3302b09":"laughing","ga2eb107a0a":"the water","ga32a1fa5d3":"He commanded him","ga3315f8b71":"the reminder","ga82f355cd2":"He causes him to die","ga9253f94ff":"may remember it","ga9ca6ad649":"would make you know","gab5e3d393e":"He will resurrect him","gaddfb1742e":"will be a matter","gaf10ef20dd":"In","gaf3ed8fd93":"honored","gaf4dfb5d52":"purify himself","gb2ba5a39f7":"and provides a grave for him","gb58cf92eef":"so would benefit him","gb6b4297705":"As for","gb85791ca2c":"of thick foliage","gbae7e2aa05":"the Deafening Blast","gbb0954e258":"striving","gc37d626b61":"as a provision","gcbade748e7":"And fruits","gcd4aae0536":"wills","gd1ef4731ec":"because","gd39fbb97e2":"rejoicing at good news","gd8b7bcf239":"of scribes","gd95e5967e8":"then He proportioned him","gdc2bb3d277":"and his father","gdc305fa431":"a man","gdcc35ff3ae":"He made easy for him","gdda839842e":"and his mother","gddc971856e":"But as for","ge03ffbe3b0":"that not","ge431f7f9ac":"will be bright","ge69ab847ef":"and for your cattle","ge82f9d9395":"to Him","gee4dddc76b":"grain","gef8f2e60cb":"the day","gefff5db415":"and his children","gf1cb57c636":"he who","gf1fdd46d8d":"they","gf459c034d9":"Then let look","gf50bc0e54e":"be reminded","gf656ec4c11":"and Gardens","gf80f8c89e8":"We poured","gf863d3f8cb":"a semen-drop"}}