{"qusxAudio":"0.1","surah":71,"layoutAgnostic":true,"language":"en","base":"https://quran-wbw-audio.quran-wbw.workers.dev/en/v1/","words":{"78991":"g76af55403a","78992":"gb7d424ba77","78993":"g81a5051fe2","78994":"g4374aaee24","78995":"g766b59046f","78996":"g33b8220108","78997":"g4c8ea4760f","78998":"g7f2a4f1416","78999":"g0b1e95cfd9","79000":"g51de2b835b","79001":"g33b8220108","79002":"gea0c5c013b","79003":"g6d174dfd0a","79004":"gd14dc06d6e","79006":"g52bf6644b0","79007":"g2686924471","79008":"g5f18e66adb","79009":"ge302e6323b","79010":"g59a8fcb3c1","79011":"g168cbb2ea5","79013":"g33b8220108","79014":"g90cc18463f","79015":"ga08da15c96","79016":"g9b02bacef2","79017":"gff0b082781","79019":"g6fb773c20a","79020":"g463ed54002","79021":"gde04fa0e29","79022":"g83042b41b2","79023":"g627b13ca2b","79024":"g43eef9a62a","79025":"gd05b650388","79026":"gb175ef8835","79027":"ga85ed0f0a4","79028":"gac88c93660","79029":"gab789dae55","79030":"g30603fa9e0","79031":"g9aafb6d0a8","79032":"g557f255516","79033":"g6f688d10de","79034":"g958f57f57d","79035":"g8af56de682","79036":"g97accafb53","79038":"g52bf6644b0","79039":"g1283596266","79040":"g3a45776aac","79041":"g200b57390a","79042":"g7cfdfa1533","79043":"g1be2a44cb5","79044":"g1b8c5baf72","79046":"g9d7f5ee2a8","79047":"gad37699b35","79048":"g79b30c2c64","79049":"g672fccd70b","79050":"g3c315f4983","79052":"g8a0dd2f6e4","79053":"g7797da707a","79054":"g955aba41f6","79055":"gf2c2c62dde","79056":"g98910a6e9a","79057":"g69f2d8283e","79058":"g994c595d03","79059":"gaf10ef20dd","79060":"g78e86edb7f","79061":"gc7da49febb","79062":"g51e4a995c1","79063":"gea7c9510ec","79064":"g40380b7e65","79065":"g4194a05546","79067":"g6f8f8e9f76","79068":"g3a45776aac","79069":"g882ca033c9","79070":"g7acca69b4f","79072":"g6f8f8e9f76","79073":"g3a45776aac","79074":"g0bd9b93ac7","79075":"g0d9db5d881","79076":"g4fe5334779","79077":"g0d9db5d881","79078":"gc8de3b12d6","79080":"gac94e2c574","79081":"g05db7510f8","79082":"gde2d1f5666","79083":"gd42f34188e","79084":"gb47f363e2b","79085":"gc8eb4faf8d","79087":"g126db6733a","79088":"g46e0e25f12","79089":"g8ee425ab4b","79090":"g17d24a5d72","79092":"g51704effc6","79093":"g4f30010fcc","79094":"gf0919f67e3","79095":"g6c93780533","79096":"g463ed54002","79097":"g2c8aedcda4","79098":"g6c93780533","79099":"g463ed54002","79100":"g3e6f1344dd","79102":"ga110e6b9a3","79103":"g6756971584","79104":"g557f255516","79105":"g61d2e4ff8e","79106":"g11fcc8e337","79107":"ga6f22a53f0","79109":"gedbff76e2f","79110":"gf796147c00","79111":"g732f9999ad","79113":"g64bd302f33","79114":"gb1884d1b59","79115":"g0b064373fb","79116":"g8060aae724","79117":"ga08da15c96","79118":"g91a7762beb","79119":"ge6be7e92ea","79120":"g3377deecec","79122":"g386ef990b8","79123":"g6a1c6667c6","79124":"g87c4c3f55b","79125":"g6c213665d6","79126":"g386ef990b8","79127":"g1d4a9ef0fb","79128":"gdd2149dbd5","79130":"g73bed96bc4","79131":"g844464ece6","79132":"g0b1e95cfd9","79133":"g378a670717","79134":"g44c90194e5","79136":"g6f8f8e9f76","79137":"gbe7edcc5c5","79138":"gfc4ab73364","79139":"g0809b9af1d","79140":"ge0ae447d42","79142":"g73bed96bc4","79143":"ge572f95f9d","79144":"g463ed54002","79145":"g378a670717","79146":"g11be2c678e","79148":"gfd5287191d","79149":"g87c4c3f55b","79150":"g4b5ec3f814","79151":"g414768af9d","79153":"gabc1350f2b","79154":"g81a5051fe2","79155":"g1283596266","79156":"g60ba088a7d","79157":"g42dfbfcb15","79158":"g420beff0d1","79159":"gc4bbef5681","79160":"g2f16995ce2","79161":"g9008005048","79162":"g2672f2066f","79163":"gefff5db415","79164":"g672fccd70b","79165":"g2a96b0203b","79167":"gd433eba700","79168":"gac4d3e8658","79169":"gfbc8fae6b1","79171":"ge26764554e","79172":"g64bd302f33","79173":"g31aed9e37e","79174":"g45177fd024","79175":"ga9e6345688","79176":"g31aed9e37e","79177":"g34813d2bfe","79178":"g2f3522d840","79179":"g0c3db4a38e","79180":"g2f3522d840","79181":"g41ea471123","79182":"gd076b45dbf","79183":"g788ce57c73","79185":"gedbff76e2f","79186":"g9a4ae61eac","79187":"gf25470201a","79188":"g2f3522d840","79189":"gf9c9758ad2","79190":"g819a3827c0","79191":"g672fccd70b","79192":"g33eb87484c","79194":"ge05584535f","79195":"gb166dc3108","79196":"g91c2544f95","79197":"g0ad9bf67ba","79198":"g0833918887","79199":"g2f3522d840","79200":"g7eb1baa357","79201":"gf7f3302a6b","79202":"g0b1e95cfd9","79203":"g94a325fbad","79204":"ga08da15c96","79205":"g3fddf0ed62","79207":"gbe5c6de504","79208":"g81a5051fe2","79209":"g1283596266","79210":"g64bd302f33","79211":"g31aed9e37e","79212":"gdb3d405b10","79213":"g378a670717","79214":"gc5fe0200d1","79215":"g10d3b7c763","79216":"gb6af10f701","79218":"g72ae838eba","79219":"g958f57f57d","79220":"g688988e85a","79221":"g517088cdb8","79222":"gd379ec38e8","79223":"g2f3522d840","79224":"gbfdee32ae6","79225":"g672fccd70b","79226":"g86ae42920b","79227":"g8ff697822d","79229":"g1283596266","79230":"gfe2c8eca89","79231":"gb1c1d8736f","79232":"gda924af112","79233":"gb36767d62a","79234":"gd3be51ed19","79235":"gd17789e942","79236":"ge3e4bbe856","79237":"g3458b6f940","79238":"g61fbaa7575","79239":"ga9e6345688","79240":"gf9c9758ad2","79241":"g819a3827c0","79242":"g672fccd70b","79243":"gca4ce96a3a"},"text":{"g05db7510f8":"Ask forgiveness","g0809b9af1d":"and bring you forth","g0833918887":"the Fire","g0ad9bf67ba":"then made to enter","g0b064373fb":"How","g0b1e95cfd9":"from","g0bd9b93ac7":"announced","g0c3db4a38e":"Suwa","g0d9db5d881":"to them","g10d3b7c763":"of the disbelievers","g11be2c678e":"an expanse","g11fcc8e337":"to Allah","g126db6733a":"He will send down","g1283596266":"My Lord","g168cbb2ea5":"clear","g17d24a5d72":"in abundance","g1b8c5baf72":"and day","g1be2a44cb5":"night","g1d4a9ef0fb":"the sun","g200b57390a":"invited","g2672f2066f":"his wealth","g2686924471":"O my people","g2a96b0203b":"in loss","g2c8aedcda4":"gardens","g2f16995ce2":"Did not","g2f3522d840":"and not","g30603fa9e0":"When","g31aed9e37e":"leave","g3377deecec":"in layers","g33b8220108":"That","g33eb87484c":"in error","g3458b6f940":"And the believing men","g34813d2bfe":"Wadd","g378a670717":"the earth","g386ef990b8":"and made","g3a45776aac":"Indeed , I","g3c315f4983":"in flight","g3e6f1344dd":"rivers","g3fddf0ed62":"any helpers","g40380b7e65":"and were arrogant","g414768af9d":"wide","g4194a05546":"with pride","g41ea471123":"Yaguth","g420beff0d1":"and followed","g42dfbfcb15":"disobeyed me","g4374aaee24":"to","g43eef9a62a":"for","g44c90194e5":"as a growth","g45177fd024":"your gods","g463ed54002":"for you","g46e0e25f12":"rain from the sky","g4b5ec3f814":"in paths","g4c8ea4760f":"Warn","g4f30010fcc":"with wealth","g4fe5334779":"and I confided","g51704effc6":"And provide you","g517088cdb8":"they will mislead","g51de2b835b":"before","g51e4a995c1":"with their garments","g52bf6644b0":"He said","g557f255516":"not","g59a8fcb3c1":"a warner","g5f18e66adb":"Indeed , I am","g60ba088a7d":"Indeed , they","g61d2e4ff8e":"you attribute","g61fbaa7575":"and the believing women","g627b13ca2b":"and give you respite","g64bd302f33":"Do not","g672fccd70b":"except","g6756971584":"is for you","g688988e85a":"You leave them","g69f2d8283e":"They put","g6a1c6667c6":"the moon","g6c213665d6":"a light","g6c93780533":"and make","g6d174dfd0a":"a punishment","g6f688d10de":"is delayed","g6f8f8e9f76":"then","g6fb773c20a":"He will forgive","g72ae838eba":"Indeed , you","g732f9999ad":"in stages","g73bed96bc4":"And Allah","g766b59046f":"his people","g76af55403a":"Indeed , we","g7797da707a":"Every time","g788ce57c73":"and Nasr","g78e86edb7f":"their ears","g79b30c2c64":"my invitation","g7acca69b4f":"publicly","g7cfdfa1533":"my people","g7eb1baa357":"they found","g7f2a4f1416":"your people","g8060aae724":"did create","g819a3827c0":"the wrongdoers","g81a5051fe2":"Nuh","g83042b41b2":"your sins","g844464ece6":"has caused you to grow","g86ae42920b":"a wicked","g87c4c3f55b":"therein","g882ca033c9":"invited them","g8a0dd2f6e4":"and indeed , I","g8af56de682":"You","g8ee425ab4b":"upon you","g8ff697822d":"a disbeliever","g9008005048":"increase him","g90cc18463f":"worship","g91a7762beb":"the seven","g91c2544f95":"they were drowned","g94a325fbad":"besides","g955aba41f6":"I invited them","g958f57f57d":"if","g97accafb53":"know","g98910a6e9a":"them","g994c595d03":"their fingers","g9a4ae61eac":"they have led astray","g9aafb6d0a8":"it comes","g9b02bacef2":"and fear Him","g9d7f5ee2a8":"but not","ga08da15c96":"Allah","ga110e6b9a3":"what","ga6f22a53f0":"grandeur","ga85ed0f0a4":"Indeed","ga9e6345688":"and do not","gab789dae55":"of Allah","gabc1350f2b":"said","gac4d3e8658":"a plan","gac88c93660":"the term","gac94e2c574":"Then I said","gad37699b35":"increased them","gaf10ef20dd":"In","gb166dc3108":"their sins","gb175ef8835":"specified","gb1884d1b59":"you see","gb1c1d8736f":"me","gb36767d62a":"And whoever","gb47f363e2b":"is","gb6af10f701":"as an inhabitant","gb7d424ba77":"We sent","gbe5c6de504":"And said","gbe7edcc5c5":"He will return you","gbfdee32ae6":"they will beget","gc4bbef5681":"the One Who","gc5fe0200d1":"any","gc7da49febb":"and covered themselves","gc8de3b12d6":"secretly","gc8eb4faf8d":"Oft-Forgiving","gca4ce96a3a":"in destruction","gd05b650388":"a term","gd076b45dbf":"and Yauq","gd14dc06d6e":"painful","gd17789e942":"My House","gd379ec38e8":"your slaves","gd3be51ed19":"enters","gd42f34188e":"Indeed , He","gd433eba700":"And they have planned","gda924af112":"and my parents","gdb3d405b10":"on","gdd2149dbd5":"a lamp","gde04fa0e29":"of","gde2d1f5666":"from your Lord","ge05584535f":"because of","ge0ae447d42":"a new bringing forth","ge26764554e":"And they said","ge302e6323b":"to you","ge3e4bbe856":"a believer","ge572f95f9d":"made","ge6be7e92ea":"heavens","gea0c5c013b":"comes to them","gea7c9510ec":"and persisted","gedbff76e2f":"And indeed","gefff5db415":"and his children","gf0919f67e3":"and children","gf25470201a":"many","gf2c2c62dde":"that You may forgive","gf796147c00":"He created you","gf7f3302a6b":"for themselves","gf9c9758ad2":"increase","gfbc8fae6b1":"great","gfc4ab73364":"into it","gfd5287191d":"That you may go along","gfe2c8eca89":"forgive","gff0b082781":"and obey me"}}