{"qusxAudio":"0.1","surah":101,"layoutAgnostic":true,"language":"en","base":"https://quran-wbw-audio.quran-wbw.workers.dev/en/v1/","words":{"83278":"g2044164737","83280":"ga110e6b9a3","83281":"g20f617379a","83283":"g819d96f9cd","83284":"g03f165d7a4","83285":"ga110e6b9a3","83286":"g20f617379a","83288":"gef8f2e60cb","83289":"g63598c8403","83290":"g9d4f9b1ca5","83291":"gdbcf1a1432","83292":"gadc8449c77","83294":"g2e71804f2e","83295":"g774cd42626","83296":"ga249490a86","83297":"g74edb1de40","83299":"g96ff37147c","83300":"g55d1e3ce8e","83301":"gee67b442d7","83302":"gbd05b1f1a1","83304":"g91ad6b68e4","83305":"gd8036a3c81","83306":"gc86a6ffb65","83307":"g72ccfda0ca","83309":"gddc971856e","83310":"g55d1e3ce8e","83311":"g8531bdb74f","83312":"gbd05b1f1a1","83314":"g2da23820a6","83315":"gd33f114a44","83317":"g819d96f9cd","83318":"g03f165d7a4","83319":"ga110e6b9a3","83320":"g79d4a897f4","83322":"g40367aeca6","83323":"gb4261382a0"},"text":{"g03f165d7a4":"will make you know","g2044164737":"the Striking Calamity","g20f617379a":"is the Striking Calamity","g2da23820a6":"His abode","g2e71804f2e":"and will be","g40367aeca6":"a fire","g55d1e3ce8e":"him whose","g63598c8403":"will be","g72ccfda0ca":"pleasant","g74edb1de40":"fluffed up","g774cd42626":"the mountains","g79d4a897f4":"it is","g819d96f9cd":"and what","g8531bdb74f":"are light","g91ad6b68e4":"then He","g96ff37147c":"Then as for","g9d4f9b1ca5":"the mankind","ga110e6b9a3":"what","ga249490a86":"like wool","gadc8449c77":"scattered","gb4261382a0":"intensely hot","gbd05b1f1a1":"his scales","gc86a6ffb65":"a life","gd33f114a44":"will be the Pit","gd8036a3c81":"will be in","gdbcf1a1432":"like moths","gddc971856e":"But as for","gee67b442d7":"are heavy","gef8f2e60cb":"the day"}}