{"qusxAudio":"0.1","surah":112,"layoutAgnostic":true,"language":"en","base":"https://quran-wbw-audio.quran-wbw.workers.dev/en/v1/","words":{"83596":"gdc01c6b748","83597":"g30f088ea66","83598":"geabcadcffb","83599":"gf4aceeca2f","83601":"ga08da15c96","83602":"g002cfecdea","83604":"g557f255516","83605":"g65316171c1","83606":"g2f3522d840","83607":"g1ccc2f7c87","83609":"g2f3522d840","83610":"gb47f363e2b","83611":"g7360f6e5d8","83612":"gd4dcb5b78e","83613":"g78e16822f2"},"text":{"g002cfecdea":"the Eternal , the Absolute","g1ccc2f7c87":"He is begotten","g2f3522d840":"and not","g30f088ea66":"He","g557f255516":"not","g65316171c1":"He begets","g7360f6e5d8":"for him","g78e16822f2":"any one","ga08da15c96":"Allah","gb47f363e2b":"is","gd4dcb5b78e":"equivalent","gdc01c6b748":"say","geabcadcffb":"is Allah","gf4aceeca2f":"the one"}}