{"qusxAudio":"0.1","surah":103,"layoutAgnostic":true,"language":"en","base":"https://quran-wbw-audio.quran-wbw.workers.dev/en/v1/","words":{"83361":"gfaa1bdf929","83363":"ga85ed0f0a4","83364":"gbe027fc4ef","83365":"g121acddeed","83366":"gc9279f09f8","83368":"g672fccd70b","83369":"gc8b91b55cc","83370":"g94ec44c4f4","83371":"g80db8118cc","83372":"g52281f0df5","83373":"g878154543a","83374":"gb21d2c8a9c","83375":"g878154543a","83376":"gc50fdb0215"},"text":{"g121acddeed":"is surely , in","g52281f0df5":"righteous deeds","g672fccd70b":"except","g80db8118cc":"and do","g878154543a":"and enjoin each other","g94ec44c4f4":"believe","ga85ed0f0a4":"Indeed","gb21d2c8a9c":"to the truth","gbe027fc4ef":"mankind","gc50fdb0215":"to the patience","gc8b91b55cc":"Those who","gc9279f09f8":"loss","gfaa1bdf929":"By the time"}}