{"qusxAudio":"0.1","surah":111,"layoutAgnostic":true,"language":"en","base":"https://quran-wbw-audio.quran-wbw.workers.dev/en/v1/","words":{"83568":"g48fe601c84","83569":"g884742c9c3","83570":"g65ffa02009","83571":"gc32cfdd111","83572":"g9af23f4039","83574":"g557f255516","83575":"g726f66ce92","83576":"g330317bbc5","83577":"g2672f2066f","83578":"g819d96f9cd","83579":"gf4245a55b4","83581":"g8d8edd76d7","83582":"ge43dee5c38","83583":"gde04fa0e29","83584":"g55c518c598","83586":"g01c970f74b","83587":"gf3f93e15d5","83588":"g8ee9bcf706","83590":"gaf10ef20dd","83591":"gde0060f206","83592":"g58ea7a0927","83593":"gde04fa0e29","83594":"g4c37a10deb"},"text":{"g01c970f74b":"And his wife","g2672f2066f":"his wealth","g330317bbc5":"Him","g48fe601c84":"Perish","g4c37a10deb":"palm-fiber","g557f255516":"not","g55c518c598":"Blazing Flames","g58ea7a0927":"will be a rope","g65ffa02009":"of Abu","g726f66ce92":"will avail","g819d96f9cd":"and what","g884742c9c3":"the hands","g8d8edd76d7":"He will be burnt","g8ee9bcf706":"of firewood","g9af23f4039":"and perish he","gaf10ef20dd":"In","gc32cfdd111":"Lahab","gde0060f206":"her neck","gde04fa0e29":"of","ge43dee5c38":"in a Fire","gf3f93e15d5":"the carrier","gf4245a55b4":"he earned"}}