{"qusxAudio":"0.1","surah":61,"layoutAgnostic":true,"language":"en","base":"https://quran-wbw-audio.quran-wbw.workers.dev/en/v1/","words":{"76274":"g5aa4a5338c","76275":"ga08da15c96","76276":"gd869db7fe6","76277":"g0fde5915cb","76278":"gfdc86ac359","76279":"g40477b68d2","76280":"g0fde5915cb","76281":"g378a670717","76282":"g02cc3824b7","76283":"g87e736a7ca","76284":"gc028277284","76286":"g7a81af3e59","76287":"gfc45e91c75","76288":"g94ec44c4f4","76289":"g10cff4034c","76290":"g56480e9461","76291":"ga110e6b9a3","76292":"g557f255516","76293":"g113c66fb75","76295":"g1aac405d78","76296":"g3c959078da","76297":"g8fcd25a39d","76298":"ga08da15c96","76299":"g33b8220108","76300":"g10eaf5de60","76301":"ga110e6b9a3","76302":"g557f255516","76303":"g113c66fb75","76305":"ga85ed0f0a4","76306":"ga08da15c96","76307":"gc9066be544","76308":"gc8b91b55cc","76309":"g517bd000b7","76310":"gaf10ef20dd","76311":"gc77c6d5204","76312":"g87fbcab023","76313":"gbd97385921","76314":"g16d8a646fd","76315":"gd6935684c1","76317":"g3f536d4657","76318":"gabc1350f2b","76319":"gc50c4e0f7f","76320":"gb38e765a7b","76321":"g2686924471","76322":"g10cff4034c","76323":"g44ab3ce874","76324":"gd1b565a8fe","76325":"g70f1296c07","76326":"gd6ae39ffc8","76327":"g8cd2f79d75","76328":"gab789dae55","76329":"ge302e6323b","76330":"g88bc2703a9","76331":"gbe76f579cf","76332":"g32b7fb59b9","76333":"g705443d0c9","76334":"g09851c4fdc","76335":"g73bed96bc4","76336":"g7309329e11","76337":"g4956faddb7","76338":"g32b28ca04c","76339":"g0694e01353","76341":"g3f536d4657","76342":"gabc1350f2b","76343":"g59dc310530","76344":"gf0cbc0ee7d","76345":"ga21d1656a3","76346":"gaed6a2b639","76347":"g5f8b6a01cd","76348":"g5f18e66adb","76349":"g8cd2f79d75","76350":"gab789dae55","76351":"ge302e6323b","76352":"g3b72cdf432","76353":"gf2c0bcab49","76354":"g08d5a9b439","76355":"gd6732116ae","76356":"gde04fa0e29","76357":"ga1263c3ba7","76358":"ge5ecb2124f","76359":"gab12ad132c","76360":"gef5b697f5b","76361":"g0b1e95cfd9","76362":"ged7de5d5fd","76363":"g346663b5c5","76364":"ga53a33601b","76365":"g664a55e5e0","76366":"g483857e127","76367":"g958751f171","76368":"gb289d40d06","76369":"gc2543fff3b","76370":"gd6f472f566","76371":"g168cbb2ea5","76373":"ga3349048be","76374":"g54d3b7c899","76375":"g6f283a1f7d","76376":"gf606ba3384","76377":"g76205fd077","76378":"ga08da15c96","76379":"g9cb9799933","76380":"g19f74f5642","76381":"g34b6d7a916","76382":"g4374aaee24","76383":"g0f315d32ad","76384":"g73bed96bc4","76385":"g7309329e11","76386":"g4956faddb7","76387":"g32b28ca04c","76388":"g819a3827c0","76390":"geada1ab72a","76391":"g54c7eb6c0d","76392":"gb4cfc0354d","76393":"gab789dae55","76394":"g44ac219f8b","76395":"g8877735523","76396":"g81eaeb5f11","76397":"g7779b75ecf","76398":"gdea713fc73","76399":"gaedf615647","76400":"gc7847d18b2","76402":"g30f088ea66","76403":"gbab1e4d70f","76404":"g27e7700fda","76405":"gec3ee8398a","76406":"g077baf0cd9","76407":"g725a881c43","76408":"gff7b8266ee","76409":"g5786d67de2","76410":"gf0fed7e493","76411":"g18bcfde4ec","76412":"gf5d27be167","76413":"gdea713fc73","76414":"g38d7b43461","76415":"gd97f812c8d","76417":"g7a81af3e59","76418":"gfc45e91c75","76419":"g94ec44c4f4","76420":"gc98329dcc4","76421":"g8e167fb936","76422":"g4374aaee24","76423":"g85d6e8fffa","76424":"g3d0f2e98ff","76425":"g0b1e95cfd9","76426":"g6d174dfd0a","76427":"gd14dc06d6e","76429":"g94ec44c4f4","76430":"g76345df8bd","76431":"g0a441384d5","76432":"gdc14872c5a","76433":"gaf10ef20dd","76434":"g6fee95c4cd","76435":"gab789dae55","76436":"gc3910ba3df","76437":"g095fada846","76438":"g33b8220108","76439":"g4a7d2fb8d4","76440":"g463ed54002","76441":"g958f57f57d","76442":"g8af56de682","76443":"g97accafb53","76445":"g6fb773c20a","76446":"g463ed54002","76447":"g83042b41b2","76448":"gcf9ddda639","76449":"ga148c76957","76450":"gd8f7e9c783","76451":"g0b1e95cfd9","76452":"ga61113096f","76453":"g0cf660f44b","76454":"gf4e3263746","76455":"g72ccfda0ca","76456":"gaf10ef20dd","76457":"g2c8aedcda4","76458":"g09a63fdffe","76459":"g33b8220108","76460":"g0ad1543579","76461":"g54baa9779c","76463":"g93c0f3ca43","76464":"ge90edfb831","76465":"g696a16b013","76466":"g0b1e95cfd9","76467":"ga08da15c96","76468":"g4c8126b10b","76469":"gd8c46683a8","76470":"g73a4a12b28","76471":"gdc83e550d3","76473":"g772300a28a","76474":"gb7adf77905","76475":"g94ec44c4f4","76476":"g986b1bc1eb","76477":"g43a62a8cb5","76478":"gab789dae55","76479":"gdf211ccdd9","76480":"gabc1350f2b","76481":"g59dc310530","76482":"gf0cbc0ee7d","76483":"ga21d1656a3","76484":"geb3942e639","76485":"gb7adf77905","76486":"g2e186c838c","76487":"g43eef9a62a","76488":"ga08da15c96","76489":"gabc1350f2b","76490":"gd35b4862f4","76491":"g676e6f35cf","76492":"g79e75013db","76493":"gab789dae55","76494":"gea726d3392","76495":"g33af089c80","76496":"gde04fa0e29","76497":"g42685f11da","76498":"g5f8b6a01cd","76499":"g9c66190e9b","76500":"g33af089c80","76501":"g7c519b31ea","76502":"gc8b91b55cc","76503":"g1aabddb817","76504":"gb51c31d9ce","76505":"g01c3bfb61e","76506":"gd49beaa6e0","76507":"g18abe41a47"},"text":{"g01c3bfb61e":"their enemy","g02cc3824b7":"And He","g0694e01353":"the defiantly disobedient","g077baf0cd9":"with guidance","g08d5a9b439":"was between","g095fada846":"and your lives","g09851c4fdc":"their hearts","g09a63fdffe":"of Eternity","g0a441384d5":"and His Messenger","g0ad1543579":"is the success","g0b1e95cfd9":"from","g0cf660f44b":"the rivers","g0f315d32ad":"Islam","g0fde5915cb":"is in","g10cff4034c":"Why","g10eaf5de60":"you say","g113c66fb75":"you do","g168cbb2ea5":"clear","g16d8a646fd":"were a structure","g18abe41a47":"dominant","g18bcfde4ec":"the religion","g19f74f5642":"while He","g1aabddb817":"believed","g1aac405d78":"Great is","g2686924471":"O my people","g27e7700fda":"sent","g2c8aedcda4":"gardens","g2e186c838c":"are my helpers","g30f088ea66":"He","g32b28ca04c":"the people","g32b7fb59b9":"was caused to deviate","g33af089c80":"a group","g33b8220108":"That","g346663b5c5":"whose name will be","g34b6d7a916":"is invited","g378a670717":"the earth","g38d7b43461":"dislike it","g3b72cdf432":"confirming","g3c959078da":"hatred","g3d0f2e98ff":"that will save you","g3f536d4657":"And when","g40477b68d2":"And whatever","g42685f11da":"children","g4374aaee24":"to","g43a62a8cb5":"helpers","g43eef9a62a":"for","g44ab3ce874":"do you hurt me","g44ac219f8b":"with their mouths","g463ed54002":"for you","g483857e127":"he came to them","g4956faddb7":"guide","g4a7d2fb8d4":"is better","g4c8126b10b":"and a victory","g517bd000b7":"fight","g54baa9779c":"the Great","g54c7eb6c0d":"to put out","g54d3b7c899":"is more wrong","g557f255516":"not","g56480e9461":"do you say","g5786d67de2":"to make it prevail","g59dc310530":"Isa","g5aa4a5338c":"glorifies","g5f18e66adb":"Indeed , I am","g5f8b6a01cd":"of Israel","g664a55e5e0":"But when","g676e6f35cf":"we","g696a16b013":"a help","g6d174dfd0a":"a punishment","g6f283a1f7d":"than one who","g6fb773c20a":"He will forgive","g6fee95c4cd":"the way","g705443d0c9":"by Allah","g70f1296c07":"you know","g725a881c43":"and the religion","g72ccfda0ca":"pleasant","g7309329e11":"does not","g73a4a12b28":"And give glad tidings","g73bed96bc4":"And Allah","g76205fd077":"upon","g76345df8bd":"in Allah","g772300a28a":"O you","g7779b75ecf":"His Light","g79e75013db":"are the helpers","g7a81af3e59":"O","g7c519b31ea":"So We supported","g819a3827c0":"the wrongdoers","g81eaeb5f11":"will perfect","g83042b41b2":"your sins","g85d6e8fffa":"a transaction","g87e736a7ca":"is the All-Mighty","g87fbcab023":"in a row","g8877735523":"but Allah","g88bc2703a9":"then when","g8af56de682":"You","g8cd2f79d75":"the Messenger","g8e167fb936":"I guide you","g8fcd25a39d":"with","g93c0f3ca43":"and another","g94ec44c4f4":"believe","g958751f171":"with clear proofs","g958f57f57d":"if","g97accafb53":"know","g986b1bc1eb":"be","g9c66190e9b":"and disbelieved","g9cb9799933":"the lie","ga08da15c96":"Allah","ga110e6b9a3":"what","ga1263c3ba7":"the Taurat","ga148c76957":"in Gardens","ga21d1656a3":"of Maryam","ga3349048be":"And who","ga53a33601b":"Ahmad","ga61113096f":"underneath it","ga85ed0f0a4":"Indeed","gab12ad132c":"of a Messenger","gab789dae55":"of Allah","gabc1350f2b":"said","gaed6a2b639":"O Children","gaedf615647":"dislike","gaf10ef20dd":"In","gb289d40d06":"they said","gb38e765a7b":"to his people","gb4cfc0354d":"the light","gb51c31d9ce":"against","gb7adf77905":"who","gbab1e4d70f":"is the One Who","gbd97385921":"as if they","gbe76f579cf":"they deviated","gc028277284":"the All-Wise","gc2543fff3b":"this","gc3910ba3df":"with your wealth","gc50c4e0f7f":"Musa","gc77c6d5204":"His way","gc7847d18b2":"the disbelievers","gc8b91b55cc":"Those who","gc9066be544":"Loves","gc98329dcc4":"Shall","gcf9ddda639":"and admit you","gd14dc06d6e":"painful","gd1b565a8fe":"while certainly","gd35b4862f4":"the disciples","gd49beaa6e0":"and they became","gd6732116ae":"my hands","gd6935684c1":"joined firmly","gd6ae39ffc8":"that I am","gd6f472f566":"is a magic","gd869db7fe6":"Whatever","gd8c46683a8":"near","gd8f7e9c783":"flow","gd97f812c8d":"the polytheists","gdc14872c5a":"and strive","gdc83e550d3":"to the believers","gde04fa0e29":"of","gdea713fc73":"although","gdf211ccdd9":"as","ge302e6323b":"to you","ge5ecb2124f":"and bringing glad tidings","ge90edfb831":"that you love","gea726d3392":"Then believed","geada1ab72a":"they intend","geb3942e639":"to the disciples","gec3ee8398a":"His Messenger","ged7de5d5fd":"after me","gef5b697f5b":"to come","gf0cbc0ee7d":"son","gf0fed7e493":"over","gf2c0bcab49":"that which","gf4e3263746":"and dwellings","gf5d27be167":"all of them","gf606ba3384":"invents","gfc45e91c75":"you who","gfdc86ac359":"the heavens","gff7b8266ee":"of the truth"}}