{"qusxAudio":"0.1","surah":113,"layoutAgnostic":true,"language":"en","base":"https://quran-wbw-audio.quran-wbw.workers.dev/en/v1/","words":{"83615":"gdc01c6b748","83616":"g927eebc684","83617":"g9340ea6784","83618":"ge909b4dde8","83620":"g0b1e95cfd9","83621":"gcb539d2c41","83622":"gca71c54f45","83623":"g10c21c29d3","83625":"gfedb8d268e","83626":"gcb539d2c41","83627":"g7e8e2edb3e","83628":"g30603fa9e0","83629":"g8d762c03da","83631":"gfedb8d268e","83632":"gcb539d2c41","83633":"g7edd38e63b","83634":"gaf10ef20dd","83635":"gad66a65a1d","83637":"gfedb8d268e","83638":"gcb539d2c41","83639":"g7739b20bcb","83640":"g30603fa9e0","83641":"g713ef973f9"},"text":{"g0b1e95cfd9":"from","g10c21c29d3":"He created","g30603fa9e0":"When","g713ef973f9":"he envies","g7739b20bcb":"of an envier","g7e8e2edb3e":"of darkness","g7edd38e63b":"of the blowers","g8d762c03da":"it spreads","g927eebc684":"I seek refuge","g9340ea6784":"in the Lord","gad66a65a1d":"the knots","gaf10ef20dd":"In","gca71c54f45":"of what","gcb539d2c41":"the evil","gdc01c6b748":"say","ge909b4dde8":"of the dawn","gfedb8d268e":"And from"}}