{"qusxAudio":"0.1","surah":79,"layoutAgnostic":true,"language":"en","base":"https://quran-wbw-audio.quran-wbw.workers.dev/en/v1/","words":{"81010":"g521d44da6a","81011":"g2d4dfe8dfa","81013":"g6c38d8fe5e","81014":"g5f4e484b31","81016":"gae158aea01","81017":"gbb500fcedf","81019":"g537908f3f6","81020":"g836bc5b0cf","81022":"ga3a55ee98f","81023":"g13e933956c","81025":"gef8f2e60cb","81026":"g890f059572","81027":"g178a54c349","81029":"ga8840e418a","81030":"gd8861946dc","81032":"g46140a1ed1","81033":"g6c2517c002","81034":"g5caf3e8e27","81036":"g0af6021f76","81037":"gac3f11681c","81039":"g13968aa02b","81040":"g1b0fd57bf9","81041":"g3f84d85d3a","81042":"g4374aaee24","81043":"gd1296e174b","81045":"g7562b8ef64","81046":"gafdac126a1","81047":"g86a83d3070","81048":"g584cf71392","81050":"g13968aa02b","81051":"gc2543fff3b","81052":"g6f8f8e9f76","81053":"g565739b101","81054":"g816db0200e","81056":"g753e232e12","81057":"g6c5522ca8a","81058":"ga269590483","81059":"gce0b1612aa","81061":"g3879e9a793","81062":"gf1fdd46d8d","81063":"gd7d7be5508","81065":"gf6f39fbf67","81066":"g85d9691e23","81067":"g643e15acac","81068":"g472dc4b9ae","81070":"g30603fa9e0","81071":"g5f862aca23","81072":"g1a33bedbca","81073":"gdc6b376bee","81074":"g7c27588dae","81075":"ga2e8e2998d","81077":"g1ec558a60b","81078":"g4374aaee24","81079":"g2f0b70a274","81080":"gd42f34188e","81081":"gf91c881201","81083":"g1c74b9e12d","81084":"g0955dd8182","81085":"g463ed54002","81086":"g4374aaee24","81087":"g33b8220108","81088":"g6c864fa47f","81090":"gd1e698176e","81091":"g4374aaee24","81092":"g08771259b9","81093":"g2a9d353bb8","81095":"g0539f4dd22","81096":"g48821fe9ab","81097":"g54baa9779c","81099":"g2289bd6616","81100":"g16856c61fb","81102":"g6f8f8e9f76","81103":"gff87a315e5","81104":"gbb0954e258","81106":"g7ca88f8842","81107":"g834e6e15c8","81109":"g9c20f4d8d6","81110":"gb9778453e9","81111":"g08771259b9","81112":"g30b0615854","81114":"g180217074a","81115":"ga08da15c96","81116":"g3faccebb7f","81117":"g6b53b1c7e2","81118":"gda85c51d99","81120":"ga85ed0f0a4","81121":"gaf10ef20dd","81122":"g33b8220108","81123":"g5562f70aef","81124":"g24ffa2e508","81125":"g116b445958","81127":"g2011b2e81f","81128":"gb90bf90548","81129":"g5afe575efb","81130":"g1758356db2","81131":"gb44553b4b7","81132":"gdaa9ed8ef7","81134":"g1c23efcd4f","81135":"g1ab37f8616","81136":"g164092e8f7","81138":"gf54096a78d","81139":"g10430489e4","81140":"g1dc0529088","81141":"g043960eafb","81143":"gda307de1b1","81144":"g405906c9d5","81145":"g33b8220108","81146":"g90333962b0","81148":"g4f636ad5a8","81149":"g21e8d78d67","81150":"g07e45a9628","81151":"g3325cb04bd","81153":"g9a8cec35bb","81154":"ga5524d547a","81156":"gc37d626b61","81157":"g463ed54002","81158":"ge69ab847ef","81160":"g664a55e5e0","81161":"g74f5cacb17","81162":"g74059c6e54","81163":"g54baa9779c","81165":"gef8f2e60cb","81166":"g0d5df7e045","81167":"g8175e3c875","81168":"ga110e6b9a3","81169":"g9774c549bb","81171":"gbb0a0985f7","81172":"g00e95d3c23","81173":"g008686212f","81174":"gbeb2839537","81176":"g96ff37147c","81177":"g43fb5c6522","81178":"g2adc989c4b","81180":"g43206f309f","81181":"ge0d8a85d7b","81182":"g735a9ab1a5","81184":"g6408618c27","81185":"g00e95d3c23","81186":"g6c5522ca8a","81187":"g2635373010","81189":"gddc971856e","81190":"g43fb5c6522","81191":"g50758f72a1","81192":"g8b6cd6222f","81193":"ge3d8504861","81194":"ged007e1753","81195":"g8e21a0c7a2","81196":"g0b1e95cfd9","81197":"g8ac568e45b","81199":"g6408618c27","81200":"gee87e62281","81201":"g79d4a897f4","81202":"g8c2fe0871e","81204":"gdca9d705a8","81205":"g5780daf6db","81206":"g9c6f6fbfc5","81207":"g30603fa9e0","81208":"ge5e47ead05","81210":"gf39a056b48","81211":"g2011b2e81f","81212":"gde04fa0e29","81213":"g6c6e653028","81215":"g4374aaee24","81216":"g08771259b9","81217":"g396df7810c","81219":"gf8969a18a0","81220":"g8af56de682","81221":"geb775f6070","81222":"g30f02af432","81223":"g437fea173e","81225":"g1f1ff8ff1d","81226":"gef8f2e60cb","81227":"gb12673e7f0","81228":"g557f255516","81229":"g28fd3e1119","81230":"g672fccd70b","81231":"g504a8f116e","81232":"g1758356db2","81233":"g61b55153dd"},"text":{"g008686212f":"to him who","g00e95d3c23":"the Hellfire","g043960eafb":"its brightness","g0539f4dd22":"Then he showed him","g07e45a9628":"its water","g08771259b9":"your Lord","g0955dd8182":"Would","g0af6021f76":"their eyes","g0b1e95cfd9":"from","g0d5df7e045":"will remember","g10430489e4":"its night","g116b445958":"fears","g13968aa02b":"they say","g13e933956c":"the matter","g164092e8f7":"and proportioned it","g16856c61fb":"and disobeyed","g1758356db2":"or","g178a54c349":"the quaking one","g180217074a":"So seized him","g1a33bedbca":"his Lord","g1ab37f8616":"its ceiling","g1b0fd57bf9":"will we","g1c23efcd4f":"He raised","g1c74b9e12d":"And say","g1dc0529088":"and brought out","g1ec558a60b":"Go","g1f1ff8ff1d":"As though they","g2011b2e81f":"Are you","g21e8d78d67":"from it","g2289bd6616":"but he denied","g24ffa2e508":"for whoever","g2635373010":"is the refuge","g28fd3e1119":"they had remained","g2a9d353bb8":"so you would fear","g2adc989c4b":"transgressed","g2d4dfe8dfa":"violently","g2f0b70a274":"Firaun","g30603fa9e0":"When","g30b0615854":"the Most High","g30f02af432":"for him who","g3325cb04bd":"and its pasture","g33b8220108":"That","g3879e9a793":"and behold","g396df7810c":"is its finality","g3f84d85d3a":"indeed be returned","g3faccebb7f":"with an exemplary punishment","g405906c9d5":"after","g43206f309f":"And preferred","g4374aaee24":"to","g437fea173e":"fears it","g43fb5c6522":"him who","g46140a1ed1":"hearts","g463ed54002":"for you","g472dc4b9ae":"of Musa","g48821fe9ab":"the sign","g4f636ad5a8":"He brought forth","g504a8f116e":"an evening","g50758f72a1":"feared","g521d44da6a":"By those who extract","g537908f3f6":"And those who race each other","g54baa9779c":"the Great","g5562f70aef":"surely is a lesson","g557f255516":"not","g565739b101":"would be a return","g5780daf6db":"about","g584cf71392":"decayed","g5afe575efb":"creation","g5caf3e8e27":"will palpitate","g5f4e484b31":"gently","g5f862aca23":"called him","g61b55153dd":"a morning thereof","g6408618c27":"then indeed","g643e15acac":"the story","g664a55e5e0":"But when","g672fccd70b":"except","g6b53b1c7e2":"for the last","g6c2517c002":"that day","g6c38d8fe5e":"And those who draw out","g6c5522ca8a":"it","g6c6e653028":"to mention it","g6c864fa47f":"purify yourself","g6f8f8e9f76":"then","g735a9ab1a5":"of the world","g74059c6e54":"the Overwhelming Calamity","g74f5cacb17":"comes","g753e232e12":"then only","g7562b8ef64":"What ! When","g79d4a897f4":"it is","g7c27588dae":"the sacred","g7ca88f8842":"And he gathered","g816db0200e":"losing","g8175e3c875":"man","g834e6e15c8":"And called out","g836bc5b0cf":"in a race","g85d9691e23":"there come to you","g86a83d3070":"bones","g890f059572":"will quake","g8ac568e45b":"the vain desires","g8af56de682":"You","g8b6cd6222f":"standing","g8c2fe0871e":"the refuge","g8e21a0c7a2":"his soul","g90333962b0":"He spread it","g96ff37147c":"Then as for","g9774c549bb":"he strove for","g9a8cec35bb":"and the mountains","g9c20f4d8d6":"then He said","g9c6f6fbfc5":"the Hour","ga08da15c96":"Allah","ga110e6b9a3":"what","ga269590483":"will be a shout","ga2e8e2998d":"of Tuwa","ga3a55ee98f":"And those who arrange","ga5524d547a":"He made them firm","ga85ed0f0a4":"Indeed","ga8840e418a":"Follows it","gac3f11681c":"humbled","gae158aea01":"And those who glide","gaf10ef20dd":"In","gafdac126a1":"We are","gb12673e7f0":"they see it","gb44553b4b7":"the heaven","gb90bf90548":"a more difficult","gb9778453e9":"I am","gbb0954e258":"striving","gbb0a0985f7":"And will be made manifest","gbb500fcedf":"swimming","gbeb2839537":"sees","gc2543fff3b":"this","gc37d626b61":"as a provision","gce0b1612aa":"single","gd1296e174b":"the former state","gd1e698176e":"And I will guide you","gd42f34188e":"Indeed , He","gd7d7be5508":"will be awakened","gd8861946dc":"the subsequent","gda307de1b1":"and the earth","gda85c51d99":"and the first","gdaa9ed8ef7":"He constructed it","gdc6b376bee":"in the valley","gdca9d705a8":"They ask you","gddc971856e":"But as for","gde04fa0e29":"of","ge0d8a85d7b":"the life","ge3d8504861":"before his Lord","ge5e47ead05":"is its arrival","ge69ab847ef":"and for your cattle","geb775f6070":"are a warner","ged007e1753":"and restrained","gee87e62281":"Paradise","gef8f2e60cb":"the day","gf1fdd46d8d":"they","gf39a056b48":"in what","gf54096a78d":"And He darkened","gf6f39fbf67":"has","gf8969a18a0":"Only","gf91c881201":"has transgressed","gff87a315e5":"he turned his back"}}