{"qusxAudio":"0.1","surah":63,"layoutAgnostic":true,"language":"en","base":"https://quran-wbw-audio.quran-wbw.workers.dev/en/v1/","words":{"76695":"g30603fa9e0","76696":"g2071e4ba87","76697":"g77284c88f9","76698":"g13968aa02b","76699":"g14c68fcaba","76700":"g1183535574","76701":"gea5dd8f383","76702":"gab789dae55","76703":"g73bed96bc4","76704":"gb03a9feef3","76705":"g1183535574","76706":"g03cea890ff","76707":"g73bed96bc4","76708":"g05021855fb","76709":"g33b8220108","76710":"g77284c88f9","76711":"g234c7ec3a2","76713":"g47aefc4ab6","76714":"g754176aa6f","76715":"g00be9954b5","76716":"g92d0e37fad","76717":"g0b1e95cfd9","76718":"g6fee95c4cd","76719":"gab789dae55","76720":"g60ba088a7d","76721":"g3253f51150","76722":"ga110e6b9a3","76723":"g68cb71e39c","76724":"geadcd9bd2a","76726":"g33b8220108","76727":"g2fba064569","76728":"g3927f2a11f","76729":"g6f8f8e9f76","76730":"gb702424778","76731":"gf918d770d9","76732":"g76205fd077","76733":"g09851c4fdc","76734":"gfad1d4692f","76735":"g64bd302f33","76736":"g8e73840bbf","76738":"g3f536d4657","76739":"g6600d55da2","76740":"g9bd20a8b06","76741":"ga5e300b15c","76742":"gf04e1ddc97","76743":"gff6fa7a48d","76744":"g130b49fd78","76745":"g94ea03bb1d","76746":"g47e6a05c24","76747":"g7c59695802","76748":"g9b3d0145bc","76749":"g1c442c6ad2","76750":"g5873f666d0","76751":"gd1c79aa3ea","76752":"gad213ef00e","76753":"gf1fdd46d8d","76754":"g2b1efd0199","76755":"g4b1e86776b","76756":"g1105dcdf70","76757":"ga08da15c96","76758":"g0b064373fb","76759":"g231d4915bf","76761":"g3f536d4657","76762":"gb49770b684","76763":"g0d9db5d881","76764":"gd88d473b37","76765":"gd7e5c29b05","76766":"g463ed54002","76767":"g8cd2f79d75","76768":"gab789dae55","76769":"gd9e2d2c830","76770":"gc596867012","76771":"g7c81203685","76772":"g62f487b4be","76773":"g53e04da7c9","76774":"gb33671e861","76776":"g8260a576ff","76777":"ge29ef1488f","76778":"g60c25bf11f","76779":"ge29ef1488f","76780":"g1758356db2","76781":"g64bd302f33","76782":"g05db7510f8","76783":"ge29ef1488f","76784":"g85777c03b7","76785":"g8d662a606b","76786":"ga08da15c96","76787":"g0d9db5d881","76788":"ga85ed0f0a4","76789":"ga08da15c96","76790":"g7309329e11","76791":"g4956faddb7","76792":"g32b28ca04c","76793":"g0694e01353","76795":"gf1fdd46d8d","76796":"gbf25bbac8d","76797":"gdc01c6b748","76798":"g64bd302f33","76799":"g91c38fc743","76800":"gdb3d405b10","76801":"gc8b91b55cc","76802":"gffdddde2d3","76803":"g8cd2f79d75","76804":"gab789dae55","76805":"gb310f4d4d8","76806":"gf0dc37f078","76807":"g840a3a009e","76808":"gd6b80111e4","76809":"g095dded494","76810":"gda307de1b1","76811":"g786e97b3ee","76812":"g77284c88f9","76813":"g64bd302f33","76814":"g8e73840bbf","76816":"g13968aa02b","76817":"g958f57f57d","76818":"g72470ab102","76819":"g4374aaee24","76820":"g0d52be30c9","76821":"ga02169724b","76822":"g2818df1738","76823":"g21e8d78d67","76824":"g7984b6d83b","76825":"gfcaeee6913","76826":"g4020014a38","76827":"g320cfaf9fa","76828":"g52fe8e5640","76829":"g786e97b3ee","76830":"g77284c88f9","76831":"g64bd302f33","76832":"g97accafb53","76834":"g7a81af3e59","76835":"gfc45e91c75","76836":"g94ec44c4f4","76837":"gae0bfed3a8","76838":"g94ceeda532","76839":"g765f1cc92f","76840":"g2f3522d840","76841":"g291255558d","76842":"g0b1e95cfd9","76843":"g7302076874","76844":"gab789dae55","76845":"gb36767d62a","76846":"gf0d521a5dc","76847":"g33b8220108","76848":"g94a2f795e2","76849":"gf1fdd46d8d","76850":"ge362e51928","76852":"g343ef5bb3c","76853":"g0b1e95cfd9","76854":"ga110e6b9a3","76855":"gd55619c111","76856":"g0b1e95cfd9","76857":"g51de2b835b","76858":"g33b8220108","76859":"g74f5cacb17","76860":"ge0c369a1b3","76861":"g0a17e301d8","76862":"g638c1c9152","76863":"g1283596266","76864":"g573bec29ad","76865":"gb31df210ca","76866":"g43eef9a62a","76867":"gd05b650388","76868":"gd8c46683a8","76869":"g3467ad1c33","76870":"gceeb81fe52","76871":"g2d5a829c4e","76872":"g2fb24b40c9","76874":"g3c060ae933","76875":"gc9a2f4febc","76876":"g705443d0c9","76877":"g512453b3b9","76878":"g30603fa9e0","76879":"g13585e7db2","76880":"g9528a6ca14","76881":"g73bed96bc4","76882":"gd5856e9fed","76883":"gca71c54f45","76884":"g113c66fb75"},"text":{"g00be9954b5":"as a cover","g03cea890ff":"are surely His Messenger","g05021855fb":"testifies","g05db7510f8":"Ask forgiveness","g0694e01353":"the defiantly disobedient","g095dded494":"of the heavens","g09851c4fdc":"their hearts","g0a17e301d8":"the death","g0b064373fb":"How","g0b1e95cfd9":"from","g0d52be30c9":"Al-Madinah","g0d9db5d881":"to them","g1105dcdf70":"May destroy them","g113c66fb75":"you do","g1183535574":"that you","g1283596266":"My Lord","g130b49fd78":"you listen","g13585e7db2":"has come","g13968aa02b":"they say","g14c68fcaba":"we testify","g1758356db2":"or","g1c442c6ad2":"They think","g2071e4ba87":"come to you","g21e8d78d67":"from it","g231d4915bf":"are they deluded","g234c7ec3a2":"are surely liars","g2818df1738":"the more honorable","g291255558d":"your children","g2b1efd0199":"are the enemy","g2d5a829c4e":"among","g2f3522d840":"and not","g2fb24b40c9":"the righteous","g2fba064569":"is because","g30603fa9e0":"When","g320cfaf9fa":"and for His Messenger","g3253f51150":"Evil is","g32b28ca04c":"the people","g33b8220108":"That","g343ef5bb3c":"And spend","g3467ad1c33":"so I would give charity","g3927f2a11f":"they believed","g3c060ae933":"But never","g3f536d4657":"And when","g4020014a38":"is the Honor","g4374aaee24":"to","g43eef9a62a":"for","g463ed54002":"for you","g47aefc4ab6":"they take","g47e6a05c24":"As if they were","g4956faddb7":"guide","g4b1e86776b":"so beware of them","g512453b3b9":"a soul","g51de2b835b":"before","g52fe8e5640":"and for the believers","g53e04da7c9":"while they","g573bec29ad":"Why not","g5873f666d0":"every","g60ba088a7d":"Indeed , they","g60c25bf11f":"whether you ask forgiveness","g62f487b4be":"turning away","g638c1c9152":"and he says","g64bd302f33":"Do not","g6600d55da2":"you see them","g68cb71e39c":"they used to","g6f8f8e9f76":"then","g6fee95c4cd":"the way","g705443d0c9":"by Allah","g72470ab102":"we return","g7302076874":"the remembrance","g7309329e11":"does not","g73bed96bc4":"And Allah","g74f5cacb17":"comes","g754176aa6f":"their oaths","g76205fd077":"upon","g765f1cc92f":"your wealth","g77284c88f9":"the hypocrites","g786e97b3ee":"but","g7984b6d83b":"the more humble","g7a81af3e59":"O","g7c59695802":"pieces of wood","g7c81203685":"And you see them","g8260a576ff":"it is same","g840a3a009e":"And for Allah","g85777c03b7":"Never","g8cd2f79d75":"the Messenger","g8d662a606b":"will forgive","g8e73840bbf":"understand","g91c38fc743":"Spend","g92d0e37fad":"so they turn away","g94a2f795e2":"then those","g94ceeda532":"divert you","g94ea03bb1d":"to their speech","g94ec44c4f4":"believe","g9528a6ca14":"its term","g958f57f57d":"if","g97accafb53":"know","g9b3d0145bc":"propped up","g9bd20a8b06":"pleases you","ga02169724b":"surely , will expel","ga08da15c96":"Allah","ga110e6b9a3":"what","ga5e300b15c":"their bodies","ga85ed0f0a4":"Indeed","gab789dae55":"of Allah","gad213ef00e":"is against them","gae0bfed3a8":"Let not","gb03a9feef3":"knows","gb310f4d4d8":"until","gb31df210ca":"You delay me","gb33671e861":"are arrogant","gb36767d62a":"And whoever","gb49770b684":"it is said","gb702424778":"they disbelieved","gbf25bbac8d":"are those who","gc596867012":"their heads","gc8b91b55cc":"Those who","gc9a2f4febc":"will be delayed","gca71c54f45":"of what","gceeb81fe52":"and be","gd05b650388":"a term","gd1c79aa3ea":"shout","gd55619c111":"We have provided you","gd5856e9fed":"is All-Aware","gd6b80111e4":"are the treasures","gd7e5c29b05":"will ask forgiveness","gd88d473b37":"Come","gd8c46683a8":"near","gd9e2d2c830":"They turn aside","gda307de1b1":"and the earth","gdb3d405b10":"on","gdc01c6b748":"say","ge0c369a1b3":"to one of you","ge29ef1488f":"for them","ge362e51928":"are the losers","gea5dd8f383":"are surely the Messenger","geadcd9bd2a":"do","gf04e1ddc97":"And if","gf0d521a5dc":"does","gf0dc37f078":"they disband","gf1fdd46d8d":"they","gf918d770d9":"so were sealed","gfad1d4692f":"so they","gfc45e91c75":"you who","gfcaeee6913":"but for Allah","gff6fa7a48d":"they speak","gffdddde2d3":"are with"}}